frase;localizzazione_benchmark;localizzazione_risultato;tempo_benchmark;tempo_risultato;grave_benchmark;grave_risultato;moto_benchmark;moto_risultato;utenti_deboli_benchmark;utenti_deboli_risultato
intorno alle 13, per cause ancora in corso d'accertamento, un camion si è ribaltato e il suo conducente è stato trasportato al pronto soccorso di fidenza in condizioni gravi;0;1;1;1;1;1;0;1;0;1
i primi soccorsi sono arrivati dagli uomini del 118;0;0;0;0;1;0;0;0;0;0
grave incidente a baganzola di parma nel primo pomeriggio;1;1;0;0;1;0;0;1;0;0
intorno alle 15:10, per cause ancora in corso d'accertamento, un furgone e un'auto si sono scontrati in tangenziale;0;1;1;1;0;0;0;0;0;0
un impatto violento che ha provocato l'uscita di strada del furgone, precipitato in un secondo momento in un viadotto a ridosso della strada ;0;1;0;0;1;1;0;0;0;0
i soccorritori del 118 hanno ritrovato il mezzo nel cortile di un'azienda;0;1;0;0;0;0;0;0;0;0
l'autista, soccorso da un'ambulanza, ha riportato ferite di media gravità ed è stato trasportato al pronto soccorso di parma ;0;0;0;0;1;0;0;0;0;0
nell'impatto sarebbe rimasto ferito anche il conducente dell'auto;0;0;0;0;1;0;0;0;0;1
nella mattinata di oggi, domenica 26 febbraio, si è verificato un incidente stradale che ha coinvolto anche un'ambulanza ma che non ha provocato, fortunatamente, feriti gravi;0;1;1;1;0;0;0;0;0;1
la dinamica è in corso di ricostruzione da parte della polizia locale il mezzo, impegnato in un servizio di trasporto, si è scontrato con un'auto che stava percorrendo la stessa via;0;1;0;1;0;0;0;0;0;0
per cause in corso di accertamento il conducente di un'auto ha perso il controllo del veicolo, che è andato a sbattere contro il guardrail;0;1;0;0;0;0;0;0;0;0
in conseguenza dell'impatto l'auto è rimasta danneggiata ed il conducente ha riportato ferite di una certa gravità in varie parti del corpo;0;1;0;0;1;1;0;0;0;0
si è schiantato contro un'auto che si trovava in sosta lungo via fleming;1;1;0;0;0;0;0;1;0;0
il conducente di un'auto è stato coinvolto in un incidente stradale nella tarda serata di giovedì 23 febbraio;0;1;1;1;0;0;0;0;0;0
erano da poco passate le ore 2230 quando, per cause in corso di accertamento, il conducente del veicolo ha perso il controllo del mezzo ed è finito contro un'auto parcheggiata;0;1;1;1;0;0;0;0;0;0
sul posto sono arrivati i soccorritori del 118 che hanno prestato le prime cure all'uomo per poi trasportarlo al pronto soccorso dell'ospedale maggiore di parma;0;1;0;0;0;1;0;0;0;0
grave incidente stradale alle ore 23 di giovedì 23 febbraio lungo l'autostrada a1;1;1;1;1;1;0;0;0;0;0
lo scontro è stato particolarmente violento ed è avvenuto all'altezza del chilometro 116 in direzione milano, tra i caselli di parma e di terre di canossa/campegine ;1;1;0;1;1;0;0;0;0;0
secondo le prime informazioni due persone sarebbero rimaste ferite ed avrebbero riportato traumi di una certa gravità in varie parti del corpo;0;0;0;0;1;1;0;0;0;1
sul posto le ambulanze del 118 e i vigili del fuoco e le pattuglie della polizia stradale;0;1;0;0;0;0;0;0;0;0
 il tratto autostradale è stato chiuso e poi riaperto alle 430 di stamattina;0;1;0;0;0;0;0;0;0;0
per causa in corso di accertamento il conducente di un'auto ha perso il controllo del veicolo, che si è ribaltato;0;0;0;0;0;0;0;1;0;0
sul posto sono arrivati i soccorritori del 118 e la polizia stradale;0;1;0;0;0;0;0;0;0;0
momenti di paura nella mattinata di mercoledì 22 febbraio a fidenza per lo scontro, avvenuto verso le ore 620, tra un'auto e una bicicletta;1;1;1;1;0;0;0;0;1;0
nelle prime ore della mattinata infatti i due mezzi sono venuti a contatti in via caduti di cefalonia;1;1;1;0;0;0;0;0;0;0
l'allarme è scattato da subito e sul posto l'ambulanza infermieristica di fidenza, che ha trasportato il ferito al pronto soccorso dell'ospedale di vaio di fidenza;0;1;0;0;1;1;0;0;0;0
sul posto anche le forze dell'ordine, che hanno effettuato i rilievi previsti per legge e gestito il traffico in zona;0;1;0;0;0;0;0;0;0;0
È morto il ciclista investito sabato mattina a monticelli terme da un'auto;1;1;0;0;1;1;0;0;1;0
la vittima è il ciclomotore 85enne domenico vernamonte;0;0;0;0;1;0;1;0;0;0
l'uomo, che si trovava a bordo della sua bicicletta quando, in corrispondenza di una rotonda, è stato centrato dal veicolo, è deceduto poco dopo il ricovero d'urgenza nel reparto di rianimazione dell'ospedale maggiore di parma;0;1;0;0;1;1;0;0;1;0
grave incidente stradale nel primo pomeriggio di domenica 19 febbraio lungo strada argini, all'altezza di basilicanova;1;1;1;1;1;0;0;0;0;0
per cause in corso di accertamento due auto si sono scontrate: l'impatto è stato violento e i due mezzi sono stati danneggiati nella parte anteriore;0;1;0;0;1;0;0;0;0;0
l'allarme è scattato da subito e sul posto sono arrivati i soccorritori del 118, che hanno prestato le prime cure ad uno dei conducenti, per poi trasportarlo al pronto soccorso dell'ospedale maggiore di parma;0;1;0;0;0;1;0;0;0;1
paura nella serata di venerdì 17 febbraio a borghetto di noceto;1;1;1;0;0;0;0;0;0;0
per cause in corso di accertamento un'auto, un'alfa romeo stelvio, si è schiantata contro il cancello di un'abitazione mentre stava percorrendo strada santa margherita;1;1;0;0;1;0;0;0;0;0
erano da poco passate le 2230 quando il conducente ha perso il controllo del veicolo, che è andato a finire contro il cancello, colpendo anche un muretto e un palo;0;1;1;1;0;1;0;1;0;1
paura lungo via montanara, nella zona di gaione, nella mattinata di giovedì 16 febbraio;1;1;1;0;0;0;0;0;0;0
l'impatto tra i veicoli è stato particolarmente violento: due persone sono rimaste ferite;0;0;0;0;1;0;0;0;0;1
sul posto i soccorritori del 118, oltre alla polizia locale che ha effettuato i rilievi previsti per legge;0;1;0;0;0;0;0;1;0;0
secondo le prime informazioni i due feriti avrebbero riportato ferite gravi, una delle due in particolare si troverebbe in condizioni serie;0;0;0;0;1;1;0;1;0;0
i conducenti di due auto sono stati trasportati al pronto soccorso dell'ospedale maggiore di parma;0;0;0;0;0;1;0;0;0;0
grave incidente nella mattinata di martedì 14 febbraio lungo via europa, nella zona di moletolo;1;1;1;1;1;0;0;0;0;0
per cause in corso di accertamento una renault captur si è ribaltata ed è finita fuori strada;0;1;0;0;0;0;0;0;0;0
erano da poco passate le ore 815 quando il conducente ha perso il controllo del mezzo, che si è poi capovolto;0;0;1;0;0;0;0;1;0;0
l'allarme è scattato da subito e sul posto sono arrivati i soccorritori del 118, oltre alla polizia stradale;0;1;0;0;0;0;0;1;0;0
il conducente e il passeggero sono stati medicati sul posto dai sanitari del 118 e poi trasportati al pronto soccorso dell'ospedale maggiore di parma;0;1;0;0;0;1;0;0;0;0
grave incidente stradale nella mattinata di giovedì 9 febbraio in località basilicagoiano, frazione del comune di montechiarugolo;1;1;1;0;1;0;0;0;0;0
secondo le prime informazioni verso le ore 740 un'auto, che stava percorrendo la strada provinciale, è finita fuori strada;0;1;1;0;0;0;0;0;0;0
momenti di paura nella mattinata di giovedì 9 febbraio in via fratelli rosselli a collecchio;1;1;1;0;0;0;0;0;0;0
erano da poco passate le ore 8 quando, per cause in corso di accertamento, un pedone è stato investito da un'auto mentre stava attraversando la strada;0;0;1;1;1;0;0;0;1;0
l'allarme è scattato da subito e sul posto sono arrivati i soccorritori del 118, oltre alla polizia locale;0;1;0;0;0;0;0;0;0;0
sul posto anche la polizia locale per i rilievi previsti per legge;0;1;0;0;0;0;0;0;0;0
secondo le prime informazioni le sue condizioni di salute sarebbero di media gravità;0;0;0;0;1;0;0;0;0;0
secondo le prime informazioni nell'incidente, che si è verificato tra parma e il tratto reggiano, sarebbero rimaste coinvolte cinque persone, che sarebbero rimaste ferite;1;1;0;0;1;0;0;0;0;0
paura nelle prime ore della mattinata di venerdì 3 febbraio a san secondo;1;0;1;0;0;0;0;0;0;0
per cause in corso di accertamento un pedone, che si trovava in via cesare battisti, è stato investito da un'auto, che sopraggiungeva proprio in quel momento;1;1;0;0;0;0;0;0;1;0
l'impatto tra il veicolo e il pedone è stato violento e sul posto sono arrivati i soccorritori del 118, oltre alla polizia locale;0;1;0;0;1;0;0;0;1;0
secondo le prime informazioni la persona ferita avrebbe riportato traumi di media gravità: dopo le prime cure sul posto sarebbe stato trasportato al pronto soccorso dell'ospedale maggiore di parma;0;1;0;0;0;1;0;0;0;0
migliorano le condizioni di salute del bambino di 10 anni investito  da un'auto nel pomeriggio del 31 dicembre a barbiano di felino;1;1;1;1;0;0;0;0;1;0
sessanta giorni di prognosi per le fratture che ha riportato in varie parti del corpo;0;0;0;0;1;0;0;0;0;0
È questo il bollettino medico del bambino - che compirà dieci anni a fine mese - ricoverato da ieri pomeriggio al pronto soccorso dell'ospedale maggiore di parma dopo lo scontro tra la sua bicicletta e un'auto;0;1;0;0;0;1;0;1;1;1
ancora da stabilire la dinamica dell'incidente avvenuto oggi pomeriggio, 31 gennaio, intorno alle 17;0;1;1;0;0;0;0;0;0;0
grave incidente stradale poco dopo le ore 7 di martedì 31 gennaio lungo viale partigiani d'italia a parma;1;1;1;1;1;1;0;1;0;0
grave incidente stradale nel tardo pomeriggio di lunedì 30 gennaio lungo viale mentana a parma;1;1;1;1;1;0;0;1;0;0
ad avere la peggio il conducente dello scooter che è caduto rovinosamente sull'asfalto, provocandosi ferite in varie parti del corpo;0;0;0;0;0;1;1;1;0;1
sul posto i soccorritori del 118 che hanno prestato le prime cure all'uomo di origine straniera per poi trasportarlo a sirene spiegate al pronto soccorso dell'ospedale maggiore di parma;0;1;0;0;1;1;0;0;0;0
secondo le prime informazioni le sue condizioni di salute sarebbero gravi;0;0;0;0;1;0;0;0;0;0
sul posto anche la polizia locale per i rilievi previsti per legge;0;1;0;0;0;0;0;0;0;0
e' stata disposta una perizia psichiatrica nei confronti del 30enne orjol lame, conducente dell'auto che il 30 ottobre si è schiantata contro un'abitazione lungo la via emilia, tra parma e reggio emilia, provocando la morte di quattro persone, la moglie 22enne, il figlio di un anno e 4 mesi e il fratello e la sorella minori della moglie, di 11 e 9 anni;1;1;1;0;1;1;0;0;0;1
code di 2 chilometri in aumento in direzione bologna e traffico in tilt -  anche lungo le tangenziale e nei pressi della rotonda di fianco al casello di parma - in seguito ad un incidente stradale che si è verificato lungo l'autostrada a1, tra parma e terre di canossa, nelle prime ore della mattinata di giovedì 26 gennaio;1;1;1;1;0;1;0;1;0;0
lo scontro tra due auto non ha provocato feriti gravi ma la viabilità ne ha risentito: lungo il tratto interessato sono segnalati due chilometri di coda;0;1;0;0;0;0;0;0;0;0
traffico in tilt anche nei pressi della rotonda di accesso al casello di parma;0;1;0;0;0;0;0;0;0;0
l'incidente è avvenuto al chilometro 111: sono in corso le operazioni di recupero dei mezzi coinvolti;1;1;0;1;0;0;0;0;0;0
alle 1530 di oggi, martedì 24 gennaio, si registrano disagi al traffico lungo la via emilia;1;1;1;0;0;0;0;0;0;0
nei pressi del distributore di benzina si sono scontrate tra di loro tre auto;0;1;0;0;0;0;0;0;0;0
stando alle prime informazioni solo una persona sarebbe rimasta ferita in modo lieve e ha necessitato delle cure del 118 (pubblica di corte e automedica della cri di fidenza): a bordo dell'ambulanza è stata trasportata in ospedale a fidenza;0;1;0;0;0;1;0;1;0;0
sul posto anche i carabinieri per gli accertamenti;0;1;0;0;0;0;0;0;0;0
grave incidente stradale nella tarda mattinata di lunedì 23 gennaio a tizzano, lungo la provinciale val parma;1;1;1;0;1;0;0;1;0;0
erano da poco passate le 1240 quando, per cause in corso di accertamento, un furgone è precipitato in una scarpata mentre stava percorrendo la strada provinciale all'altezza della località capoponte in direzione reno di tizzano;1;1;1;0;1;0;0;0;0;0
momenti di paura nella mattinata di lunedì 23 gennaio lungo via resga, nel comune di montechiarugolo;1;1;1;0;0;0;0;0;0;0
uomo è rimasto incastrato all'interno dell'abitacolo, nel canale pieno d'acqua;0;0;0;0;0;1;0;0;0;0
l'allarme è scattato da subito e in pochi minuti sono arrivati sul posto i vigili del fuoco, partiti dalla caserma di via chiavari con una squadra;0;1;0;0;0;0;0;0;0;0
nella serata di sabato 21 gennaio il conducente di un'auto è rimasto ferito in seguito ad un incidente stradale in località faviano di sotto, nel comune di lesignano bagni;1;1;1;1;1;1;0;1;0;0
l'uomo, un 43enne residente in provincia di parma, è uscito di strada mentre guidava la propria automobile, cadendo in una scarpata per circa quindici metri;0;1;0;1;0;1;0;0;0;0
sul posto è stato richiesto l'intervento del soccorso alpino dell'appennino parmense;0;1;0;0;0;0;0;0;0;0
il conducente di un autoarticolato ha cercato di svoltare, mentre stava percorrendo via partigiani d’italia - all'incrocio di via fontanella, tra colorno e mezzani - ma visto che il mezzo era più grande della carreggiata, non c'è riuscito ed il rimorchio è finito nel canale, bloccando la strada e la circolazione dei veicoli;1;1;0;1;0;1;0;0;0;1
grave incidente stradale alle ore 1220 di giovedì 19 gennaio lungo strada lodesana a fidenza;1;1;1;1;1;1;0;1;0;0
per cause in corso di accertamento due auto si sono scontrate violentemente;0;0;0;0;1;0;0;0;0;0
in conseguenza dello scontro due persone - marito e moglie anziani - sono rimasti feriti con contusioni di media gravità;0;0;0;0;0;0;0;0;0;1
l'allarme è scattato da subito e sul posto sono arrivati i soccorritori dell'ambulanza infermieristica di fidenza, i vigili del fuoco e la polizia locale;0;1;0;0;0;0;0;0;0;0
si tratta di un 30enne residente in provincia di parma che sul ponte del fiume taro dopo aver abbattuto un muro di delimitazione della ss357, a seguito della fuoriuscita di strada si è allontanato nella notte;1;1;0;0;0;1;0;0;0;0
grave incidente stradale nelle prime ore della mattinata di martedì 17 gennaio;1;1;1;1;1;0;0;0;0;0
per cause in corso di accertamento un'auto e una bicicletta si sono scontrate all'altezza di via goberti a fidenza;1;1;0;0;0;0;0;0;1;0
sul posto i soccorritori del 118 e la polizia locale, che ha effettuato i rilievi previsti per legge;0;1;0;0;0;0;0;0;0;0
il ferito, che ha riportato traumi in varie parti del corpo, è stato trasportato all'ospedale di vaio di fidenza;0;0;0;0;1;1;0;0;0;1
per cause in corso di accertamento un'auto, condotta da una donna, è finita all'interno di un fosso al lato della strada;0;1;0;0;0;0;0;0;0;0
l'allarme è scattato da subito e sul posto sono arrivati i soccorritori del 118 e una squadra dei vigili del fuoco;0;1;0;0;0;0;0;0;0;0
quando gli operatori del 115 sono arrivati sul posto per cercare di liberare la conducente, la donna era già riuscita ad uscire dal veicolo, praticamente illesa;0;1;0;1;0;0;0;0;0;1
grave incidente nella serata di venerdì 13 gennaio a respiccio di fornovo;1;1;1;0;1;0;0;0;0;0
per cause in corso di accertamento un'auto è finita contro la cancellata di un'abitazione poco prima delle ore 2130;0;1;1;0;0;0;0;0;0;0
grave incidente stradale nella notte tra lunedì 9 e martedì 10 gennaio lungo l'autostrada a1, in direzione bologna;1;1;1;0;1;1;0;0;0;0
per cause in corso di accertamento, poco dopo le ore 4, un furgone e un tir si sono scontrati mentre percorrevano la corsia in direzione sud;1;1;1;0;0;0;0;0;0;0
secondo le prime informazioni l'impatto sarebbe stato particolarmente violento e il conducente del fugone sarebbe rimasto incastrato all'interno dell'abitacolo;0;1;0;0;1;0;0;1;0;0
l'uomo, dopo essere stato liberato dai vigili del fuoco di parma, intervenuti sul posto con una squadra, è stato trasportato al pronto soccorso dell'ospedale maggiore di parma;0;1;0;0;0;1;0;0;0;0
grave incidente stradale nella serata di ieri, domenica 8 gennaio, lungo la massese, tra pilastro e torrechiara, in corrispondenza della rotonda;1;1;1;0;1;1;0;0;0;0
secondo le prime informazioni, poco prima delle ore 20, tre auto si sarebbero scontrate mentre stavano percorrendo la strada;0;0;1;0;0;0;0;0;0;0
in conseguenza dello scontro due persone sarebbero rimaste ferite, fortunatamente in maniera lieve;0;0;0;0;0;1;0;0;0;1
e' probabile che la presenza della nebbia, con la scarsa visibilità lungo via langhirano, sia stata una delle cause dell'incidente;0;1;0;0;0;0;0;0;0;0
stava percorrendo l'autostada a1 da parma in direzione reggio emilia quando ad un certo punto ha accusato un lieve malore e ha perso il controllo del mezzo pesante che stava conducendo, finendo in un canale al lato della sede stradale;1;1;0;0;0;1;0;1;0;1
un camionista è stato protagonista della disavventura nel pomeriggio di sabato 7 gennaio;0;0;1;0;0;0;0;0;0;0
secondo le prime informazioni l'uomo, che si trova in buone condizioni di salute, avrebbe perso il controllo del mezzo all'improvviso;0;0;0;0;0;0;0;1;0;0
dopo l'impatto il conducente sarebbe uscito autonomamente dal mezzo: sul posto sono poi arrivati i soccorritori del 118 che hanno prestato alcune cure al camionista, accertandosi delle sue condizioni di salute;0;1;0;0;0;1;0;0;0;0
guidava ubriaco il conducente dell'auto che all'alba di sabato 7 gennaio lungo via traversetolo in località botteghino ha investito e ucciso mohamed choukry (il ricordo dei colleghi) operaio di 59 anni, di origine marocchine e residente a parma, che stava lavorando con il camion della nettezza urbana;1;1;1;0;1;1;0;0;1;1
per l'uomo, dipendente della cooperativa cigno verde, non c'è stato nulla da fare: è stato centrato in pieno dall'auto che stava sopraggiungendo, da parma in direzione traversetolo, proprio nel momento in cui mohamed si trovava in strada e si stava apprestando a risalire a bordo del camion dei rifiuti;0;1;0;0;1;1;0;0;1;0
e' indagato per omicidio stradale il conducente 36enne dell'auto che nella serata di mercoledì 28 dicembre, poco prima delle ore 20, ha tamponato l'auto a bordo della quale viaggiava tiziana sani, la 63enne morta in seguito alle gravissime ferite riportate;0;1;1;0;1;1;0;0;0;1
lo schianto violentissimo è avvenuto lungo la massese, all'altezza di torrechiara, nei pressi del prosciuttificio fumagalli;1;1;0;0;1;0;0;0;0;0
grave incidente stradale nel primo pomeriggio di lunedì 2 gennaio 2023 lungo l'autostrada a1 in direzione bologna;1;1;1;0;1;1;0;1;0;0
erano da poco passate le 1430 quando, per cause in corso di accertamento, la conducente di un'auto ha perso il controllo del mezzo che si è ribaltato;0;0;1;0;0;0;0;1;0;0
il veicolo si è cappottato ed è rimasto al centro della carreggiata;0;0;0;0;0;0;0;1;0;0
dall'omicidio di vitalie sofroni, accoltellato a morte nel parcheggio di gaione per aver cercato di difendere un'amica alla strage della via emilia - il tragico schianto del 30 ottobre in cui hanno perso la vita 4 persone, tra cui tre bambini - all'investimento e uccisione di una donna brasiliana lungo la tangenziale, fino ai quattro morti sulle strade a cavallo tra natale e capodanno;0;1;0;1;0;1;0;0;0;1
poi la morte del sindaco di soragna matteo concari, che ha avuto un malore durante una cerimonia pubblica e la morte della 21enne irene montruccoli, deceduta all'ospedale maggiore di parma per un malore improvviso;0;0;0;0;0;1;0;0;0;1
un uomo di 60 anni, originario della provincia di cosenza e residente in svizzera, è stato arrestato dai carabinieri di viadana con l'accusa di essere il conducente dell'auto pirata che ha investito e ucciso nella notte di natale tra boretto e viadana andrea lodi rizzini, il cuoco 43enne diplomato all'istituto alberghiero magnaghi di salsomaggiore terme;1;1;1;0;1;0;0;0;1;1
sarebbe una bmw serie 1 di colore bianco l'auto pirata che ha investito e ucciso andrea lodi rizzini, il cuoco diplomato all'istituto alberghiero magnaghi di salsomaggiore terme, nella notte di natale tra boretto e viadana;0;1;0;0;1;1;0;0;1;0
i carabinieri, che stanno effettuando le indagini sotto il coordinamento della procura di mantova, infatti, hanno individuato il veicolo grazie alle immagini delle telecamere in zona;0;1;0;0;0;0;0;0;0;0
gravissimo incidente nella serata di mercoledì 28 dicembre a torrechiara, poco prima delle ore 20;1;1;1;1;1;0;0;0;0;0
un tamponamento tra due auto si è trasformato in tragedia;0;0;0;0;0;1;0;0;0;0
una donna di 63 anni, tiziana sani, è deceduta nello scontro tra le vetture, mentre un 36enne, alla guida dell'altra auto, è rimasto ferito in modo non grave;0;1;0;0;1;1;0;0;0;1
nella mattinata di mercoledì 28 dicembre due auto si sono scontrate nel territorio del comune di solignano;1;1;1;0;0;0;0;0;0;0
erano da poco passate le ore 7 quando, per cause in corso di accertamento, i due veicoli sono venuti a contatto;0;0;1;0;0;0;0;0;0;0
sul posto, oltre ai soccorritori del 118, anche i vigili del fuoco e gli agenti della polizia locale, che hanno effettuato i rilievi previsti per legge;0;1;0;0;0;0;0;0;0;1
secondo le prime informazioni due persone sarebbero rimaste ferite: una avrebbe riportato traumi lievi mentre l'altra ferite di media gravità;0;0;0;0;0;1;0;0;0;0
tre morti in meno di 48 ore;0;0;0;0;1;0;0;0;0;0
e' questo il tragico bilancio degli incidenti stradali che si sono verificati a ridosso delle festività natalizie, tra il 22 e la notte tra il 23 e il 24 dicembre nel parmense;0;1;1;0;0;0;0;0;0;0
il primo incidente si è verificato alle ore 12 del 22 dicembre: un tragico scontro frontale tra due auto, che avrebbe poi coinvolto anche un terzo veicolo, ha provocato la morte dell'89enne maria teresa bardini;0;1;1;0;1;1;0;0;0;1
incidente oggi pomeriggio sulla strada pedemontana all'altezza di bannone (frazione di traversetolo);1;1;1;0;0;0;0;0;0;0
sul posto anche i vigili urbani della pedemontana;0;1;0;0;0;0;0;0;0;0
auto fuoi strada a sant'andrea di busseto, stanotte intono all'1,30;1;1;1;0;0;0;0;0;0;0
attimi di paura per i tre occupanti del veicolo, rimasti incastrati all'interno dell'abitacolo;0;0;0;0;0;1;0;0;0;1
utti hanno riportato ferite di media gravità, ricoverati all'ospedale di vaio;0;0;0;0;1;0;0;0;0;0
un incidente stradale, che si è verificato prima delle ore 10 del 22 dicembre lungo l'autostrada a1 tra i caselli di parma e terre di canossa ha provocato due chilometri di coda nel tratto interessato;1;1;1;0;0;0;0;0;0;0
nel tratto dell'a1 e lungo l'a15 in mattinata si sono verificati alcuni rallentamenti a causa della nebbia;0;1;0;0;0;0;0;0;0;0
maxi incidente lunedì mattina sulla ss336, la statale che porta all'aeroporto di malpensa;1;1;1;0;0;0;0;0;0;0
lunghe code lungo la tangenziale ovest a causa di un incidente stradale avvenuto lunedì mattina, intorno alle 7;1;1;1;1;0;0;0;1;0;0
nelle immagini diffuse dalla polizia di stato, ecco gli istanti del tragico incidente automobilistico avvenuto nella notte tra il 17 e il 18 febbraio al casello milano-ghisolfa dell'autostrada a4, costato la vita alla 54enne laura amato e l'amica, 59 anni, claudia turconi;1;1;1;1;1;1;0;0;0;1
prima l'impatto con il tir, poi le sirene dei soccorritori;0;0;0;0;1;0;0;0;0;0
ma per lei non c'è stato nulla da fare;0;0;0;0;1;0;0;0;0;0
una donna di 33 anni alla guida di un volkswagen caddy è morta in un incidente sull'autostrada a4 tra la barriera di ghisolfa e l'uscita di certosa - in direzione venezia - nella tarda mattinata di mercoledì 22 febbraio;1;1;1;0;1;1;0;0;0;1
una settimana, più o meno, in cui sarebbe però avvenuta un'escalation che lo ha portato in due ospedali diversi, in un aeroporto - senza successo - e poi al volante di quella macchina piombata come un proiettile sulla lancia ypsilon a bordo della quale si trovavano la 54enne laura amato e l'amica, 59 anni, claudia turconi;0;1;0;0;0;0;0;0;0;1
continuano le indagini sull'incidente avvenuto nella notte tra venerdì e sabato al casello di milano ghisolfa sulla a4 costato la vita alle due donne, che tornavano a casa dopo aver festeggiato il compleanno di laura, operatrice sanitaria alla clinica macedonio melloni di milano;1;1;1;0;1;1;0;0;0;1
grave incidente martedì mattina sulla milano-meda, nel tratto compreso tra l'innesto per la tangenziale nord di milano e l'uscita di paderno;1;1;1;0;1;0;0;0;0;0
È stato assolto con formula piena il macchinista dell'atm accusato di omicidio colposo per la morte di una turista coreana di 20 anni che, la sera del 10 febbraio di tre anni fa, in piazzale oberdan, era stata investita da un tram della linea 9, guidato proprio dall'imputato;1;1;1;1;1;1;0;1;0;1
tre giovani sono rimasti feriti in un incidente stradale tra la notte di lunedì e martedì lungo la strada provinciale 203, a noviglio (milano);1;1;1;1;0;0;0;0;0;1
un 41enne morto;0;0;0;0;1;0;0;0;0;0
È questo il tragico bilancio di un incidente stradale avvenuto lunedì mattina lungo la strada provinciale 192, nel territorio comunale di gravellona lomellina, nel pavese;1;1;1;1;1;1;0;1;0;0
la 60enne viaggiava insieme a laura amato, 54 anni, tornava da una festa organizzata per celebrare il compleanno dell'amica, morta con lei;0;0;0;0;1;0;0;0;0;0
grave incidente stradale sabato pomeriggio in pieno centro a milano, dove una ragazza di 20 anni, di origini asiatiche, è stata investita da un tram di atm;1;1;1;1;1;1;0;0;1;0
per cause ancora in corso di accertamento, verso le 1340, la giovane è finita sotto un mezzo della linea 3;0;0;1;0;0;0;0;0;0;0
tragico incidente stradale nella notte tra venerdì e sabato a milano, costato la vita a due donne di 54 anni (laura amato, chi era) e 60 anni;1;1;1;0;1;1;0;0;0;0
un uomo di 65 anni è in ospedale dopo essere stato trascinato da un tir lungo la tangenziale est di milano, venerdì mattina;1;1;1;0;1;1;0;0;0;1
È successo verso le otto meno venti nel tratto fra il raccordo con l'autostrada a1 a san donato milanese e l'uscita della paullese, in direzione nord;1;1;1;0;0;0;0;0;0;0
un'auto sui binari, a seveso;1;0;0;0;0;0;0;0;0;0
È accaduto nel tardo pomeriggio di giovedì 16 febbraio quando una nissan con al volante una donna di 41 anni è finita sui binari ferroviari dopo che la guidatrice ha perso il controllo del mezzo;0;1;1;1;0;1;0;0;0;1
